{
  "$schema": "https://json-schema.org/draft/2020-12/schema",
  "$id": "https://github.com/dritory/substratum/schema/puzzle.schema.json",
  "title": "Naturalness Puzzle",
  "description": "A first-class node for a structural puzzle that the standard frameworks expose without resolving: a measured (or theoretically forced) number that has no natural explanation in the baseline theory. Puzzles are connected to data/ entries and benchmarks/ where applicable, and serve as targets for mechanisms/ to address.",
  "type": "object",
  "required": ["id", "name", "kind", "summary", "references"],
  "properties": {
    "id": {
      "type": "string",
      "pattern": "^[a-z0-9_]+$",
      "description": "Stable slug used as the filename."
    },
    "name": { "type": "string" },
    "aliases": {
      "type": "array",
      "items": { "type": "string" }
    },
    "kind": {
      "type": "string",
      "enum": ["naturalness", "pattern", "coincidence", "consistency"],
      "description": "naturalness = an unprotected small or large number; pattern = a structured set of values without explanation in the baseline (mass hierarchies, mixing patterns); coincidence = numerical match between unrelated quantities; consistency = a theoretical-consistency demand (vacuum stability, anomaly cancellation) not yet derived from a deeper structure."
    },
    "summary": {
      "type": "string",
      "description": "Plain-English statement of the puzzle, 1-3 sentences."
    },
    "characteristic_numbers": {
      "type": "array",
      "description": "The 'ugly numbers' that motivate the puzzle. Each entry pairs the measured value with its naive theoretical expectation and the resulting gap.",
      "items": {
        "type": "object",
        "required": ["symbol", "value", "expected"],
        "properties": {
          "symbol": { "type": "string" },
          "value": { "type": ["number", "string"] },
          "expected": { "type": ["number", "string"] },
          "gap_log10": {
            "type": ["number", "string", "null"],
            "description": "Approximate log10 of value/expected (signed). Null when the gap is not numerically meaningful."
          },
          "units": { "type": "string" },
          "note": { "type": "string" }
        }
      }
    },
    "data_links": {
      "type": "array",
      "description": "Optional list of data/<id> entries that bear directly on this puzzle.",
      "items": { "type": "string" }
    },
    "benchmark_links": {
      "type": "array",
      "description": "Optional list of benchmarks/<id> entries that bound this puzzle's parameters.",
      "items": { "type": "string" }
    },
    "principles_stressed": {
      "type": "array",
      "description": "Foundational principles this puzzle stresses. Same enum as schema/anomaly.schema.json.",
      "items": {
        "type": "object",
        "required": ["principle", "status"],
        "properties": {
          "principle": {
            "type": "string",
            "enum": [
              "unitarity",
              "causality",
              "lorentz_invariance",
              "cpt",
              "equivalence_principle",
              "lepton_flavor_universality",
              "gauge_invariance",
              "locality",
              "background_independence",
              "naturalness",
              "none"
            ]
          },
          "status": {
            "type": "string",
            "enum": ["would_violate", "stresses", "tests", "none", "contested"]
          },
          "note": { "type": "string" }
        }
      }
    },
    "history": {
      "type": "string",
      "description": "Brief sketch of when the puzzle was articulated and how its framing has evolved."
    },
    "references": {
      "type": "array",
      "minItems": 1,
      "items": {
        "type": "object",
        "required": ["citation"],
        "properties": {
          "citation": { "type": "string" },
          "doi": { "type": "string" },
          "arxiv": { "type": "string" },
          "url": { "type": "string" }
        }
      }
    },
    "tags": {
      "type": "array",
      "items": { "type": "string" }
    }
  },
  "additionalProperties": false
}
